index;question;context;answers;id
14;What percentage of electricity was obtained from zero carbon energy source?;cope 2, limited Scope 3  without Category 15financed emissions. 100% of all electricity from zero carbon energy sourcein NLB and NLB Kom;{'text': ['100%'], 'answer_start': [64]};0
16;How many key values were defined in 2022?;p, and launched with several implementationinitiatives. As a result, 3 key values and 15 behaviours were defined.ContentsCEO StatementKey;{'text': ['3'], 'answer_start': [69]};1
18;How many Sustainable Development goals does the Group focus on?;ations,financing and investment activities.The Group focuses on key 5 Sustainable Development Goals those which reflect its greatest impa;{'text': ['5'], 'answer_start': [68]};2
19;How many key impact areas did NLB Group prioritize?;sis and country needs. Based on these analysis, NLBGroup prioritized 3 key impact areas and announced 4 keytargets.Principle 1 alignment;{'text': ['3'], 'answer_start': [69]};3
20;How many targets were announced?;hese analysis, NLBGroup prioritized 3 key impact areas and announced 4 keytargets.Principle 1 alignmentNLB Groups CommitmentWe will al;{'text': ['4'], 'answer_start': [69]};4
21;What percentage of electricity purchased from a zero carbon energy source is purchased in Slovenia and Serbia?;ectricity used by NLB Group purchased from zero carbonenergy source, 100% in Slovenia and Serbia respectively.;{'text': ['100%'], 'answer_start': [69]};5
22;How many decision-making bodies are there?;Management Board Membersare supported by directors at B-1 level in3 decision-making bodiesOversees the integration of thesustainability;{'text': ['3'], 'answer_start': [66]};6
24;How much electricity was purchased from zero-carbon sources in two largest and most material entities?;gnificant reduction of CO2emissionsin 2022 was due to the fact that 100% electricity waspurchased from zero-carbon sources in two largest and;{'text': ['100%'], 'answer_start': [68]};7
26;How many women are on NLBs Supervisory Board?;n and 1 woman. The Supervisory Board of NLB has 10 members7 men and 3 women.CEO StatementKey Highlights 2022About This ReportNLB Group ;{'text': ['3'], 'answer_start': [68]};8
32;How many EU Taxonomy - voluntary disclosures are there?;ndividuals in EUR million 9 53EU Taxonomy - voluntary disclosures 3EU Taxonomy Eligible NFRD clients in EUR million 653.567 627.292E;{'text': ['3'], 'answer_start': [29]};9
33;How many subsidiary banks are in the NLB Group?;ficant locations are presented parent bank NLB, d.d. Slovenia, and 7 subsidiary banks NLB Banka a.d., Skopje North Macedonia  NLB Bank;{'text': ['7'], 'answer_start': [67]};10
48;How many strategic pillars does the NLB sustainability roadmap have?;ng term.1. NLB sustainability roadmap encompasses decisive approach, 3 strategic pillarsSustainable Operations, Sustainable Finance, Contr;{'text': ['3'], 'answer_start': [69]};11
49;How many strategic pillars are there?;ng term.1. NLB sustainability roadmap encompasses decisive approach, 3 strategic pillarsSustainable Operations, Sustainable Finance, Contr;{'text': ['3'], 'answer_start': [69]};12
57;In Slovenia and Serbia, what percentage of electricity is purchased from CO2-neutral sources?;In Slovenia and Serbia, 100% of electricityused is purchased from CO2-neutral sources.3. By 2025;{'text': ['100%'], 'answer_start': [24]};13
58;What percentage reduction of operational carbon footprint was achieved?; 46 % reduction of operational carbon footprintScope 1 and Scope 2, lim;{'text': ['46'], 'answer_start': [1]};14
62;How many behaviours were defined?;ith several implementationinitiatives. As a result, 3 key values and 15 behaviours were defined.ContentsCEO StatementKey Highlights 2022A;{'text': ['15'], 'answer_start': [69]};15
64;How many impact areas along business lines were identified in the NLB Group impact analysis?;on the NLB Group impactanalysis, first performed in 2021, altogether 13 impact areasalong business lines were identified. ;{'text': ['13'], 'answer_start': [69]};16
65;How many material issues were listed for NLB Groups responsible operation and sustainable development?; in the same geographical andcultural area. Based on this, we listed17 material issues for NLB Groupsresponsible operation and sustainable;{'text': ['17'], 'answer_start': [68]};17
66;How many material issues did Senior Management assess?;the six countrieswhere we are present, who evaluated eachone of the 17 material issues to determinethe importance of these issues for NLBG;{'text': ['17'], 'answer_start': [68]};18
67;How many members did the Committee have in 2022?;Throughout 2022, the Committee had 17 members andwas enlarged to 20 members in 2023. The Chairman of theC;{'text': ['17'], 'answer_start': [35]};19
70;How many reports were processed by NLB d.d. in the area of fraud investigation?;In the area of fraud investigation NLB d.d. processed 41reports and NLB Group members 34 reports of suspicionsof harmful beh;{'text': ['41'], 'answer_start': [54]};20
72;How many big taxpayers had special tax status in Slovenia in 2021?;rs who have appropriate internaltax controls in place. In 2021, only 11 big taxpayers had suchstatus in Slovenia. This status, which is gran;{'text': ['11'], 'answer_start': [69]};21
73;How many entities of NLB Group were included in calculation?;ootprintreport verification, disclosure and reporting. Altogether, 19 entities of NLB Group were included incalculation. Beside NLB and su;{'text': ['19'], 'answer_start': [67]};22
74;How many men took parental leave?;om home every day.Parental leaveIn 2022, 254 employees 214 women, 40 men took parentalleave. Some of the employees started parental leav;{'text': ['40'], 'answer_start': [66]};23
75;How many members are on the Management Board of NLB?;LB has 6 members 5 men and 1 woman. The Supervisory Board of NLB has 10 members7 men and 3 women.CEO StatementKey Highlights 2022About T;{'text': ['10'], 'answer_start': [69]};24
76;How many practical workshops were organised specifically for the needs of older people?;heir money with using digitalchannels.For this reason, we organised 10 practical workshopsspecifically tailored to the needs of older peopl;{'text': ['10'], 'answer_start': [68]};25
77;How many workshops were organized specifically for older peoples needs?;heir money with using digitalchannels.For this reason, we organised 10 practical workshopsspecifically tailored to the needs of older peopl;{'text': ['10'], 'answer_start': [68]};26
78;How many workshops did NLB run in 2022?;kills for older people workshops online and offline.in 2022 we ran 13 workshops with a total of 121 participants.They are mainly are perfo;{'text': ['13'], 'answer_start': [67]};27
79;How many different locations did NLB BankGo visit in 2022?;fbanking services on the road. In 2022 NLB BankGo regularlyvisited 24 different locations four days a week, and on Fridayswas present at s;{'text': ['24'], 'answer_start': [67]};28
80;How many humanitarian organisations were exempted from fees in 2022?;enttransactions to humanitarian organisations. In 2022, NLBexempted 32 humanitarian organisations from fees, whichresulted in 6,104 transac;{'text': ['32'], 'answer_start': [68]};29
81;How much money was generated by Private Individuals NLB?;introduce to the market20 different loan offers products, of which 13 are for private individuals and 7 for legal entities Microand SME.;{'text': ['13'], 'answer_start': [67]};30
83;How many months after joining NLB, what are intermediary targets to be set every five years?;folios to align withpathways to net-zero by 2050 or sooner. Within 18 months of joining, setting 2030 targets or soonerand a 2050 target;{'text': ['18'], 'answer_start': [67]};31
85;How many sports clubs did NLB support in 2022?;ditions. In 2022, for the eighth consecutive year, NLBd.d. supported 65 sports clubs throughout Slovenia. ;{'text': ['65'], 'answer_start': [69]};32
95;How many impact areas did the UNEP FI tool define in all six countries of the NLB Group operations?;The following table depicts the specific country need levelsfor all 22 impact areas defined by the UNEP FI tool in all sixcountries of the ;{'text': ['22'], 'answer_start': [68]};33
96;How many impact areas were identified?;p carried out impactanalysis and materiality analysis and identified 13 impactareas Employment, Inclusive  healthy economies, Resour;{'text': ['13'], 'answer_start': [69]};34
97;How many workshops were provided in 2022?;s based on three pillars- digital skills for older people  in 2022 13 workshops were provided with 121 participants,- content cooperation;{'text': ['13'], 'answer_start': [67]};35
98;How many Sustainable economic activities promote the transition to a low-carbon, resource-efficient and sustainable economy?;11 Sustainable economic activities promote the transition to a low-carbo;{'text': ['11'], 'answer_start': [0]};36
99;How many consecutive years did Top Employer receive the First ESG Rating?;ongthe best 15% of banks as assessedby Sustainalytics.TopEmployer7th consecutive yearThe firstESGratingWe are focused on our journey t;{'text': ['7th'], 'answer_start': [65]};37
100;How many trees were saved?; 70%at NLB Group level. Paper consumption was reduced by 17%, thus 866 treeswere saved. 6,176 trees were planted by NLB Group employeest;{'text': ['866'], 'answer_start': [67]};38
101;What bank is the leading bank in Slovenia?; position and the impact of itsactivities.NLB Group is comprised of NLB, the leading and systemicallymost important bank in Slovenia, seven ;{'text': ['NLB'], 'answer_start': [42]};39
102;How many branches does NLB Group have in all markets where it operates?;B Group in numbers as at 31 December 2022 An extensive network of 440 branches in all markets whereNLB Group operates. More than 2.7 mil;{'text': ['440'], 'answer_start': [66]};40
104;How many levels does NLB Skladi tackle the sustainable development activities?;company. NLB Skladi tackles the sustainable developmentactivities at two levels 1. Harmonisation within the NLB Groupat company level and 2.;{'text': ['two'], 'answer_start': [69]};41
105;How many most important stakeholder groups did NLB Group identify?;Through a materiality analysis, we identified the six mostimportant stakeholder groups employees, investors/shareholders;{'text': ['six'], 'answer_start': [50]};42
106;How many times was the evaluation performed?;r NLB Groupssustainable operations. The evaluationwas performed in two parallel tracks onewith NLB Group internal stakeholders,i.e. ;{'text': ['two'], 'answer_start': [67]};43
107;How many parallel tracks did the evaluation of NLB Groups sustainable operations take place?;r NLB Groupssustainable operations. The evaluationwas performed in two parallel tracks onewith NLB Group internal stakeholders,i.e. ;{'text': ['two'], 'answer_start': [67]};44
108;How many countries are there in which we are present?;nesurvey sent to the designated externalstakeholders throughout the six countrieswhere we are present, who evaluated eachone of the 17 mate;{'text': ['six'], 'answer_start': [68]};45
109;How many main stakeholder groups did the NLB Group identify through stakeholder mapping?;Through stakeholder mappingwe recognised six mainstakeholder groups employees,private and business clients,sup;{'text': ['six'], 'answer_start': [41]};46
123;How many trees did the bank donate to Prishtina?;rted the initiative To Love and Protectthe Nature and donated around 200 trees to beplanted in Prishtina in the last two years. By doingso, ;{'text': ['200'], 'answer_start': [69]};47
127;Who reimburses its employees?;e i.e., home office have not been taken into consideration, althoughNLB reimburses its employees.;{'text': ['NLB'], 'answer_start': [68]};48
128;What was the consumption of various resources converted to?;e electricity.HeatingMeasurement included consumption converted to MWh of various resources natural gas, heating oil, liquid petroleum gas;{'text': ['MWh'], 'answer_start': [67]};49
130;How much fuel was consumed in the baseline year?;Altogether, the consumption was reduced by 15% compared to 2021, and 10% compared tothe baseline year.Fuel consumptionFuel consumption con;{'text': ['10%'], 'answer_start': [69]};50
131;By 2025, what percentage of paper prints were to be reduced?;roject in 2020. After thorough analysis the target was setto achieve 50% reduction of number of paper prints in itsoperations by 2025 compar;{'text': ['50%'], 'answer_start': [69]};51
132;How many trees did NLB save?;Thus, we saved 866 trees.Paper usage in NLB was lower by 26%, which is the highestredu;{'text': ['866'], 'answer_start': [15]};52
136;What percentage of NLB Groups employees were women in 2021?;roup by genderAs in 2021, at its significant locations of employment 70% ofNLB Groups employees were women and 30% men at the endof 2022.G;{'text': ['70%'], 'answer_start': [69]};53
137;What percentage were men in 2022?;t locations of employment 70% ofNLB Groups employees were women and 30% men at the endof 2022.Graph Number of employees in NLB GroupNLB d;{'text': ['30%'], 'answer_start': [68]};54
138;How many new employees did NLB Group hire in 2022?;re of new employees in NLBby gender and ageIn 2022, NLB Group hired 926 new employees at its significantlocations of employment, of which 28;{'text': ['926'], 'answer_start': [68]};55
140;How much did the employee turnover rate increase between 2021 and 2022?; age in 2022Compared to 2021, the turnover rate in 2022 increased by 6%,mostly due to the higher number of retirements and earlyretirements,;{'text': ['6%,'], 'answer_start': [69]};56
141;How much did the rate of employee turnover in NLB Group increase in 2022?; age in 2022Compared to 2021, the turnover rate in 2022 increased by 6%,mostly due to the higher number of retirements and earlyretirements,;{'text': ['6%,'], 'answer_start': [69]};57
142;How many employees took parental leave in 2022?;eesin NLB Group workedfrom home every day.Parental leaveIn 2022, 254 employees 214 women, 40 men took parentalleave. Some of the employ;{'text': ['254'], 'answer_start': [65]};58
143;How many people were included in the company in 2022?;aim of developing the organisationalculture and leaders, we included 136 individuals in thehighest management positions in the entire NLB Gro;{'text': ['136'], 'answer_start': [69]};59
144;How many individuals were included with the company by 2022 to develop the organisational culture and leaders?;aim of developing the organisationalculture and leaders, we included 136 individuals in thehighest management positions in the entire NLB Gro;{'text': ['136'], 'answer_start': [69]};60
145;How many people in the NLB Group participated in a 360-degree feedback exercise on the impact of their leadership on employees?;aim of developing the organisationalculture and leaders, we included 136 individuals in thehighest management positions in the entire NLB Gro;{'text': ['136'], 'answer_start': [69]};61
146;How many students and occasional workers were employed in 2022?;opportunities or practice to students.In 2022, there were altogether 172 students and occasionalworkers employed in different areas of work ;{'text': ['172'], 'answer_start': [69]};62
148;How many authorized representatives does the Bank have?;intopics of interest are related to working conditions.The Bank has one authorized representative assigned forcooperation in labor relations;{'text': ['one'], 'answer_start': [68]};63
149;A total of what percentage for members of supervisory boards?;ntary achievement of the goal of sexual diversity by the end of2026 40% for members of supervisory boards and a total of 33% for members ofs;{'text': ['40%'], 'answer_start': [68]};64
162;What percentage of all CSR activities were aligned with UN SDGs?;n overview of key CSR activities with the greatestimpact group-wide.40% of all CSR activitieswere aligned with at leastone of the UN SDG go;{'text': ['40%'], 'answer_start': [68]};65
163;What percentage of all CSR activities were aligned with at least one of the UN SDG goals?;n overview of key CSR activities with the greatestimpact group-wide.40% of all CSR activitieswere aligned with at leastone of the UN SDG go;{'text': ['40%'], 'answer_start': [68]};66
164;How many companies participated in the FrameOfHelp project in 2022?;In 2022, as many as 300 companies participated theFrameOfHelp project, with which NLB Group;{'text': ['300'], 'answer_start': [20]};67
168;How many stages of personal finance management are there in the Bankarium museum?;nued its mission in strengthening financialliteracy. Walking through six stages of personal financemanagement, visitors can play digital game;{'text': ['six'], 'answer_start': [69]};68
170;How many years old is Slovenias banking heritage?;of world banking in a multimedia introduction. Then, theyexplore the 200-year-old banking heritage in the Slovenianterritory. SDG4  Quality;{'text': ['200'], 'answer_start': [69]};69
182;How much of a reduction in paper print will be achieved by 2025?;50% reduction of paper print by 202575% of all electric energy from zer;{'text': ['50%'], 'answer_start': [0]};70
183;How many countries does Slovenia have subsidiaries in?;king groups. The Group is presentin a market of 17 million people in six countries Bosniaand Herzegovina, Montenegro, Serbia, the Republic o;{'text': ['six'], 'answer_start': [69]};71
184;How many main countries of operation are there?; activities consumer, business, corporate, andinvestment banking six main countries of operation Slovenia, Bosnia andHerzegovina, North ;{'text': ['six'], 'answer_start': [65]};72
185;How many countries does the NLB Group operate in?;eed levelsfor all 22 impact areas defined by the UNEP FI tool in all sixcountries of the NLBGroup operations based on the data collected on ;{'text': ['six'], 'answer_start': [69]};73
186;How many stakeholders did the materiality analysis work with?;nted a materiality analysis, whichidentified and closely worked with six main stakeholdersinvestors, employees, private clients, regulatory ;{'text': ['six'], 'answer_start': [69]};74
192;How many advisors does NLB have?;covers 733 advisors, 53% bank advisors and 47% financialadvisors. All advisors ;{'text': ['733'], 'answer_start': [7]};75
193;How much will NLB reduce the number of paper prints in its operations by 2025 compared to 2019?;BGroup will decreasethe number ofpaper prints in itsoperations by 50%comparedto 2019.Number of printsinclusive healthyeconomiesBy 2;{'text': ['50%'], 'answer_start': [66]};76
194;By 2025, NLB Group will decrease the number of paper prints in its operations by what percentage compared to 2019?;B Group will decrease the number of paperprints in its operations by 50% compared to 2019.- introduction of digital signatures and digital to;{'text': ['50%'], 'answer_start': [69]};77
196;How much of the electricity used by NLB Group is purchased from zero-carbon energy sources?;m zero-carbonsources.At the end of 2022, we are already approaching 70% of allelectricity used by NLB Group purchased from zero-carbonenerg;{'text': ['70%'], 'answer_start': [68]};78
197;By 2025, NLB Group will decrease the number of paper prints in its operations by what percentage compared to 2019?;B Group willdecrease the number of paperprints in its operations by 50%compared to 2019NLB Group has decreased paper prints in 2022 by 43%;{'text': ['50%'], 'answer_start': [68]};79
204;By what year does the United Nation want to harmonise credit and investment portfolios with zero net emissions?; credit and investment portfolios with reaching zeronet emissions by 2050 or earlier. We have continued developinga range of green products an;{'text': ['2050'], 'answer_start': [69]};80
207;In what year will we continue to address all ESG pillars in all our banking members throughout the region?;The latter is clear to us. In 2023 we will continue to developand address all ESG pillars in all our ba;{'text': ['2023'], 'answer_start': [30]};81
208;In what year did NLB receive its first ESG rating?;In 2022, NLB received itsfirst ESG rating, placing it amongthe best 15% of ;{'text': ['2022'], 'answer_start': [3]};82
211;What was NLB Group rated as low risk by ESG Risk rating Sustainalytics?;porate and sustainabilitygovernance standards. NLB Group was rated 17.7  low risk by ESG Risk ratingSustainalytics. Sustainability mana;{'text': ['17.7'], 'answer_start': [67]};83
212;How many hours were invested in sustainability related employee trainings?;adopted and upgradedto increase embeddedness of ESG in operations. 1,452 hours were invested in sustainability relatedemployee trainings.;{'text': ['1,452'], 'answer_start': [67]};84
219;In what year did NLB Banka, Beograd merge with Komercijalna Banka?; Srpska.vii Market share in the Federation of BiH.viii In April 2022 NLB Banka, Beograd merged with Komercijalna Banka, Beograd.CEO State;{'text': ['2022'], 'answer_start': [64]};85
220;In what year did the NLB Group become a signatory to the UN PRB and UNEP FI member?;ave been part of NLB Group since very beginning of itsoperations. In 2020, the Bank faced the biggest strategicmilestone, when it became a sig;{'text': ['2020'], 'answer_start': [69]};86
221;When was the NLB group sustainability programme adopted?;opportunities, the NLB Group Sustainability Programmewas adopted in 2020. ;{'text': ['2020'], 'answer_start': [68]};87
222;When did the programme evolve into a comprehensive NLB Group Sustainability Framework?;The programme evolved in 2021 intoa comprehensive NLB Group Sustainability Framework, themandator;{'text': ['2021'], 'answer_start': [25]};88
223;When was the Environmental and Social Management System developed and implemented?;mentation of the Environmental and Social ManagementSystem ESMS in 2021. ESMS is a part of a comprehensive riskmanagement system within NLB ;{'text': ['2021'], 'answer_start': [67]};89
230;What year did NLB continue its focus on fulfilling the impact and target setting commitments?;e we can have the most significant impacts.Activities and results in 2022NLB Group continued its focus on fulfilling the impact andtarget set;{'text': ['2022'], 'answer_start': [69]};90
231;In what year did NLB Group join the United-Nations-Convened Net-Zero Banking Alliance?;t national and regionalframeworks.Activities and results in 2022In 2022 the Group joined the United-Nations-Convened Net-ZeroBanking Alli;{'text': ['2022'], 'answer_start': [60]};91
232;By 2030, what will be the share of active digital retail users in the NLB Group by the year 2025?;25, the share of active digital retail users in theNLB Group will be 55%.Impact area Inclusive  healthy economiesTarget achivements in 2022;{'text': ['55%.'], 'answer_start': [69]};92
237;How much of the energy used in the NLB Group will come from zero-carbon sources by 2030?;porate financing.Publicly announced target by 2030By the year 2030, 75% of all electric energy used in the NLBGroup will come from zero-carb;{'text': ['75%'], 'answer_start': [68]};93
238;What percentage of all electric energy used by NLB comes from zero carbon sources?;porate financing.Publicly announced target by 2030By the year 2030, 75% of all electric energy used in the NLBGroup will come from zero-carb;{'text': ['75%'], 'answer_start': [68]};94
240;When did the NLB Group offer customers loans with a sustainable financing component at a lower interest rate than the Banks regular offer?;rong partnerships in sustainablesolutions.Activities and results in 2022The Group offered customers loans with a sustainable financingcomp;{'text': ['2022'], 'answer_start': [68]};95
243;In what year did NLB Group organize its first Investor Day?;ments into the operations. Organizing special investor days In May 2022, NLB Group organized its first Investor Day in Belgrade. Presentin;{'text': ['2022'], 'answer_start': [67]};96
244;In what year did NLB conduct a materiality analysis?;on people and the environment,we conducted a materiality analysis in 2021, which also served as a foundation for sustainabilityactivities in 2;{'text': ['2021'], 'answer_start': [69]};97
258;Throughout what year were several training sessions on ESG topics organised for different internal stakeholders?;pics forthe Management Board and Supervisory Board alike.Throughout 2022, several training sessions on these topicswere organised for differe;{'text': ['2022'], 'answer_start': [68]};98
260;How much did the bank reduce the use of paper in 2022 compared to the previous year?;our initiatives,the bank managed to reduce the use of paper by upto 19% in 2022 compared to the previous year.;{'text': ['19%'], 'answer_start': [68]};99
265;In what year did the Bank begin preparations for the Policy on Respect for Human Rights in NLB d.d. and the NLB Group?;isabilities, consumerrights and forced labour.In the second half of 2022 the Bank started with preparationsof the comprehensive Policy on Res;{'text': ['2022'], 'answer_start': [68]};100
273;What percentage of electricity carbon footprint was reduced in Slovenia?;a, NLB Group managed to reduce totalelectricity carbon foot print by 70%. Slight reduction in othercountries was also achieved. Furthermore, i;{'text': ['70%.'], 'answer_start': [69]};101
274;When were more personal meetings and other events with external stakeholders conducted?;eetings and other events with external stakeholders wereconducted in 2022 compared to previous years. The Group willstrive to further monitor ;{'text': ['2022'], 'answer_start': [69]};102
277;In what year did NLB acquire N Banka?;% for 2019 and 2020, and 0,1% for 2021 from the prior report.2 In 2022 NLB acquired N Banka, whereas merger of both entities is planned in 2;{'text': ['2022'], 'answer_start': [66]};103
281;What year did Komercijalna Banka Beograd become part of NLB Group?;issions also for 2019 and 2020, despitebecoming part of NLB Group in 2021. However, GHG Protocol suggests recalculating baseline year in case o;{'text': ['2021'], 'answer_start': [69]};104
