question;answer;context
Why was EU Taxonomy developed? ;"To achieve ambitious goal of net-zero Green House Gas
(GHG) emissions by 2050, one of the tools that was developed
was the EU Taxonomy - a classification system created
to help promote sustainable finance and investment.";"To achieve ambitious goal of net-zero Green House Gas
(GHG) emissions by 2050, one of the tools that was developed
was the EU Taxonomy - a classification system created
to help promote sustainable finance and investment. It
provides a common language for disclosing information on
the sustainability of economic activities, which can improve
transparency and comparability across different companies
and sectors. This can help investors and stakeholders make
informed decisions and drive improvements in sustainability
performance"
What is the commitment of NLB and NLB Group in terms of decarbonization? ;"Transitioning operational and attributable GHG emissions
from their lending and investment portfolios to align with
pathways to net-zero by 2050 or sooner.";"As a signatory of the UN Net-Zero Banking Alliance, NLB and
NLB Group are committed to transitioning operational and attributable GHG emissions
from their lending and investment portfolios to align with
pathways to net-zero by 2050 or sooner."
